{
  "arms": [
    "A",
    "B",
    "C",
    "C-dbg"
  ],
  "artifact_type": "kata_plan",
  "cells": [
    {
      "arm": "A",
      "bindings": [
        {
          "model": "UNBOUND",
          "prompt": "You are the solo role of the SDD conveyor. Read the kernel skill card (the constitution) and your role card before acting; carry every stage yourself under the full gate set; the gates, not your judgment, decide done. Work only your stage for: {args}",
          "role": "solo"
        }
      ],
      "cell_id": "A/bugfix-1/r0",
      "instance": "bugfix-1",
      "rep": 0
    },
    {
      "arm": "A",
      "bindings": [
        {
          "model": "UNBOUND",
          "prompt": "You are the solo role of the SDD conveyor. Read the kernel skill card (the constitution) and your role card before acting; carry every stage yourself under the full gate set; the gates, not your judgment, decide done. Work only your stage for: {args}",
          "role": "solo"
        }
      ],
      "cell_id": "A/bugfix-2/r0",
      "instance": "bugfix-2",
      "rep": 0
    },
    {
      "arm": "A",
      "bindings": [
        {
          "model": "UNBOUND",
          "prompt": "You are the solo role of the SDD conveyor. Read the kernel skill card (the constitution) and your role card before acting; carry every stage yourself under the full gate set; the gates, not your judgment, decide done. Work only your stage for: {args}",
          "role": "solo"
        }
      ],
      "cell_id": "A/bugfix-3/r0",
      "instance": "bugfix-3",
      "rep": 0
    },
    {
      "arm": "A",
      "bindings": [
        {
          "model": "UNBOUND",
          "prompt": "You are the solo role of the SDD conveyor. Read the kernel skill card (the constitution) and your role card before acting; carry every stage yourself under the full gate set; the gates, not your judgment, decide done. Work only your stage for: {args}",
          "role": "solo"
        }
      ],
      "cell_id": "A/bugfix-4/r0",
      "instance": "bugfix-4",
      "rep": 0
    },
    {
      "arm": "A",
      "bindings": [
        {
          "model": "UNBOUND",
          "prompt": "You are the solo role of the SDD conveyor. Read the kernel skill card (the constitution) and your role card before acting; carry every stage yourself under the full gate set; the gates, not your judgment, decide done. Work only your stage for: {args}",
          "role": "solo"
        }
      ],
      "cell_id": "A/greenfield-1/r0",
      "instance": "greenfield-1",
      "rep": 0
    },
    {
      "arm": "A",
      "bindings": [
        {
          "model": "UNBOUND",
          "prompt": "You are the solo role of the SDD conveyor. Read the kernel skill card (the constitution) and your role card before acting; carry every stage yourself under the full gate set; the gates, not your judgment, decide done. Work only your stage for: {args}",
          "role": "solo"
        }
      ],
      "cell_id": "A/greenfield-2/r0",
      "instance": "greenfield-2",
      "rep": 0
    },
    {
      "arm": "A",
      "bindings": [
        {
          "model": "UNBOUND",
          "prompt": "You are the solo role of the SDD conveyor. Read the kernel skill card (the constitution) and your role card before acting; carry every stage yourself under the full gate set; the gates, not your judgment, decide done. Work only your stage for: {args}",
          "role": "solo"
        }
      ],
      "cell_id": "A/greenfield-3/r0",
      "instance": "greenfield-3",
      "rep": 0
    },
    {
      "arm": "A",
      "bindings": [
        {
          "model": "UNBOUND",
          "prompt": "You are the solo role of the SDD conveyor. Read the kernel skill card (the constitution) and your role card before acting; carry every stage yourself under the full gate set; the gates, not your judgment, decide done. Work only your stage for: {args}",
          "role": "solo"
        }
      ],
      "cell_id": "A/greenfield-4/r0",
      "instance": "greenfield-4",
      "rep": 0
    },
    {
      "arm": "A",
      "bindings": [
        {
          "model": "UNBOUND",
          "prompt": "You are the solo role of the SDD conveyor. Read the kernel skill card (the constitution) and your role card before acting; carry every stage yourself under the full gate set; the gates, not your judgment, decide done. Work only your stage for: {args}",
          "role": "solo"
        }
      ],
      "cell_id": "A/legacy-1/r0",
      "instance": "legacy-1",
      "rep": 0
    },
    {
      "arm": "A",
      "bindings": [
        {
          "model": "UNBOUND",
          "prompt": "You are the solo role of the SDD conveyor. Read the kernel skill card (the constitution) and your role card before acting; carry every stage yourself under the full gate set; the gates, not your judgment, decide done. Work only your stage for: {args}",
          "role": "solo"
        }
      ],
      "cell_id": "A/legacy-2/r0",
      "instance": "legacy-2",
      "rep": 0
    },
    {
      "arm": "A",
      "bindings": [
        {
          "model": "UNBOUND",
          "prompt": "You are the solo role of the SDD conveyor. Read the kernel skill card (the constitution) and your role card before acting; carry every stage yourself under the full gate set; the gates, not your judgment, decide done. Work only your stage for: {args}",
          "role": "solo"
        }
      ],
      "cell_id": "A/legacy-3/r0",
      "instance": "legacy-3",
      "rep": 0
    },
    {
      "arm": "A",
      "bindings": [
        {
          "model": "UNBOUND",
          "prompt": "You are the solo role of the SDD conveyor. Read the kernel skill card (the constitution) and your role card before acting; carry every stage yourself under the full gate set; the gates, not your judgment, decide done. Work only your stage for: {args}",
          "role": "solo"
        }
      ],
      "cell_id": "A/legacy-4/r0",
      "instance": "legacy-4",
      "rep": 0
    },
    {
      "arm": "B",
      "bindings": [
        {
          "model": "UNBOUND",
          "prompt": "You are the specifier role of the SDD conveyor. Read the kernel skill card (the constitution) and your role card before acting; convert tasks into scenario law and QA procedures; you never write production code. Work only your stage for: {args}",
          "role": "specifier"
        },
        {
          "model": "UNBOUND",
          "prompt": "You are the maker3 role of the SDD conveyor. Read the kernel skill card (the constitution) and your role card before acting; implement and clean in one stage (merged coder+cleaner); you never author the law. Work only your stage for: {args}",
          "role": "maker3"
        },
        {
          "model": "UNBOUND",
          "prompt": "You are the checker3 role of the SDD conveyor. Read the kernel skill card (the constitution) and your role card before acting; harden and verify in one stage (merged hardener+qa); independent of the makers' assumptions. Work only your stage for: {args}",
          "role": "checker3"
        }
      ],
      "cell_id": "B/bugfix-1/r0",
      "instance": "bugfix-1",
      "rep": 0
    },
    {
      "arm": "B",
      "bindings": [
        {
          "model": "UNBOUND",
          "prompt": "You are the specifier role of the SDD conveyor. Read the kernel skill card (the constitution) and your role card before acting; convert tasks into scenario law and QA procedures; you never write production code. Work only your stage for: {args}",
          "role": "specifier"
        },
        {
          "model": "UNBOUND",
          "prompt": "You are the maker3 role of the SDD conveyor. Read the kernel skill card (the constitution) and your role card before acting; implement and clean in one stage (merged coder+cleaner); you never author the law. Work only your stage for: {args}",
          "role": "maker3"
        },
        {
          "model": "UNBOUND",
          "prompt": "You are the checker3 role of the SDD conveyor. Read the kernel skill card (the constitution) and your role card before acting; harden and verify in one stage (merged hardener+qa); independent of the makers' assumptions. Work only your stage for: {args}",
          "role": "checker3"
        }
      ],
      "cell_id": "B/bugfix-2/r0",
      "instance": "bugfix-2",
      "rep": 0
    },
    {
      "arm": "B",
      "bindings": [
        {
          "model": "UNBOUND",
          "prompt": "You are the specifier role of the SDD conveyor. Read the kernel skill card (the constitution) and your role card before acting; convert tasks into scenario law and QA procedures; you never write production code. Work only your stage for: {args}",
          "role": "specifier"
        },
        {
          "model": "UNBOUND",
          "prompt": "You are the maker3 role of the SDD conveyor. Read the kernel skill card (the constitution) and your role card before acting; implement and clean in one stage (merged coder+cleaner); you never author the law. Work only your stage for: {args}",
          "role": "maker3"
        },
        {
          "model": "UNBOUND",
          "prompt": "You are the checker3 role of the SDD conveyor. Read the kernel skill card (the constitution) and your role card before acting; harden and verify in one stage (merged hardener+qa); independent of the makers' assumptions. Work only your stage for: {args}",
          "role": "checker3"
        }
      ],
      "cell_id": "B/bugfix-3/r0",
      "instance": "bugfix-3",
      "rep": 0
    },
    {
      "arm": "B",
      "bindings": [
        {
          "model": "UNBOUND",
          "prompt": "You are the specifier role of the SDD conveyor. Read the kernel skill card (the constitution) and your role card before acting; convert tasks into scenario law and QA procedures; you never write production code. Work only your stage for: {args}",
          "role": "specifier"
        },
        {
          "model": "UNBOUND",